{"account":{"account_observation_id":"d1c69f7c353627f638858ef23267ea507634af3ca31383a69529c16f41e02238","accounting_passed":true,"actual_gross_fraction":0.1328870951865341,"actual_gross_notional":135.0,"actual_position_count":2,"approved_target_gross":0.6,"available_balance":900.0,"current_drawdown_fraction":0.0,"equity":1015.9,"equity_change":15.899999999999977,"margin_fraction":0.06644354759326705,"margin_used":67.5,"observation_hash":"ed68c6f2aa1330de6759c22977bc7fcb1a24f1e0bc6972622b3649edf644df76","peak_drawdown_at":"2026-07-20T00:07:00+00:00","peak_drawdown_fraction":0.0,"peak_equity":1015.9,"previous_equity":1000.0,"quote_asset":"USDT","unavailable_fields":[],"wallet_balance":1015.9},"alerts":{"audit_last_hash":"1ffcbc79883fc89c5f224b646351590f0dbb4e85d0561d366f3d51cacb9f578b","audit_row_count":2,"delivery_state_counts":{"DEAD_LETTER":0,"DELIVERED":0,"PENDING":1,"RETRY_WAIT":0},"open_alert_count":1,"open_severity_counts":{"CRITICAL":1,"HALT":0,"INFO":0,"WARNING":0},"unresolved":[{"alert_id":"04c6629d6dbb1fad296eb01fe2e21f7467f4a0d9c98022a9cf9f1a6e339c34c5","category":"runtime_state","event_hash":"7d0d7e4c46b26946e0cea2435261b321f08cec01071213c1a3224585e4ed0ba2","occurred_at":"2026-07-20T00:06:10+00:00","severity":"CRITICAL","source_hash":"347894307e8b64d0a12cdee3d03f642ed8205f51a76abd48c15d8a95abe95ff8","source_id":"7235be1e5517d1d12d0af49885d2d12c395393d3172ba34a80e3ed733be8f0a2","source_type":"runtime_ledger","summary":"Deterministic local DailyBrief fixture.","title":"CRITICAL fixture event","trace_id":"859b6d86e507a49f031ab64199a3f55b325266a138a76d68450267e5c1afbd33"}]},"brief_hash":"b07d06539b0357559ebc25ae9ae1655012f09f4ccb7162cdf256cb2e5cf7e29f","brief_id":"3818e924951c27941f7da82d1b626814901e131216ae8753572ca2d0be3fc87a","generated_at":"2026-07-20T00:07:20+00:00","llm":{"reports":[],"status":"not_requested_deterministic_only"},"orders":{"fill_count":1,"fill_fees_by_asset":{"USDT":0.1},"fill_notional":100.0,"fill_quantity":0.001,"latest_recovery_status":"none","open_order_ids":[],"plan_executable":true,"planned_cancellation_count":1,"planned_order_count":3,"protective_order_count":1,"protective_order_runtime_statuses":{"CANCELED":1},"runtime_order_count":3,"scope":"runtime_ledger_orders_and_fills","status_counts":{"CANCELED":2,"FILLED":1},"unavailable_fields":["order_latency","slippage"],"unresolved_order_ids":[]},"owner_actions":["review_open_critical_alerts"],"pnl":{"current_drawdown_fraction":0.0,"fees":1.1,"funding":2.0,"marked_at":"2026-07-20T00:07:00+00:00","passed":true,"peak_drawdown_at":"2026-07-20T00:07:00+00:00","peak_drawdown_fraction":0.0,"peak_equity":1015.9,"realized_equity":1015.9,"residual":-2.3092638912203256e-14,"residual_tolerance":0.001,"scope":"latest_nav_mark","signal_nav":1.018,"standalone_executable_nav":1.0159,"trading_pnl":5.0,"transfers":10.0,"unavailable_fields":["slippage"]},"positions":[{"actual_quantity":0.001,"approved_target_weight":0.4,"expected_quantity":0.001,"strategy_links":[{"decision_id":"7a854290d3acce326f9335d05d44d21af603650b9f917eb6230388372930ae71","reason_codes":["BASE_MASTER_GATE_ACTIVE","BTCUSDT_TARGET_LONG"],"strategy_id":"test_strategy"}],"symbol":"BTCUSDT"},{"actual_quantity":0.01,"approved_target_weight":0.2,"expected_quantity":0.01,"strategy_links":[{"decision_id":"7a854290d3acce326f9335d05d44d21af603650b9f917eb6230388372930ae71","reason_codes":["BASE_MASTER_GATE_ACTIVE","BTCUSDT_TARGET_LONG"],"strategy_id":"test_strategy"}],"symbol":"ETHUSDT"}],"readiness":{"gates":[{"detail":"snapshot_and_audit_chain_verified","gate":"runtime_ledger","status":"pass"},{"detail":"no_recoverable_order_states","gate":"order_state_recovery","status":"pass"},{"detail":"latest_three_way_reconciliation_passed","gate":"three_way_reconciliation","status":"pass"},{"detail":"no_dead_letters","gate":"notification_delivery","status":"pass"},{"detail":"open_severity_counts:INFO=0,WARNING=0,CRITICAL=1,HALT=0","gate":"unresolved_alerts","status":"block"},{"detail":"daily_brief_never_authorizes_orders","gate":"live_orders_allowed","status":"block"}],"reconciliation_hash":"44c4c3196a96626c6f8280a55770731fdcba8247751ca6b77730c52bab7a282e","reconciliation_id":"f03627a6bacf2d5f44357aaa3847da2a4b91f474459c32b03c42a68b574ea6a2","status":"attention_required"},"report_date":"2026-07-20","schema_version":1,"source_hashes":{"decision_batch_manifest":"82eea9224d7ef5944fd14aba4f508d26e6ac91ead0efe890ee0b74f298a720d8","notification_store":"e8068972653d8993c9e57b55f0a64e780fb285a75d953cd40ed8ee4a640abbf1","runtime_ledger":"40e9a694a114218bf688312c71b3e1ee47c1d924f207343eeb18ed49827e0351","strategy_registry":"8cd7c74e2d0b577aff9eb2d1a892b4906fb5e2c77191359315cc3701f36e0b9e"},"source_updated_at":"2026-07-20T00:07:10+00:00","status":"attention_required","strategies":[{"decision":{"decision_id":"7a854290d3acce326f9335d05d44d21af603650b9f917eb6230388372930ae71","reason_codes":["BASE_MASTER_GATE_ACTIVE","BTCUSDT_TARGET_LONG"],"target_weights":{"BTCUSDT":0.4,"ETHUSDT":0.2}},"live_orders_allowed":false,"maximum_gross":0.6,"maximum_stress_loss_fraction":0.01,"promotion_status":"shadow","strategy_id":"test_strategy","strategy_version":"1.2.3"}]}
